{
	"platform": "general",
	"url": "https://www.bestbuy.com/",
	"crawlerUsed": "playwright",
	"scrapedAt": "2026-06-25T19:00:47.313Z",
	"data": {
		"ssl": {
			"present": true
		},
		"seo": {
			"title": "Best Buy | Official Online Store | Shop Now & Save",
			"meta_description": "Shop Best Buy for electronics, computers, appliances, cell phones, video games & more new tech. Store pickup & free 2-day shipping on thousands of items.",
			"canonical": "https://www.bestbuy.com",
			"json_ld": {
				"present": false,
				"type": null
			},
			"json_ld_schema": null,
			"hero_headings": [
				"Shop deals by category"
			],
			"suggested_keywords": [
				"Best Buy",
				"Best Buy Shop deals by category"
			]
		},
		"analytics": {
			"google_analytics": true,
			"tag_manager": false
		},
		"blog": {
			"detected": false,
			"post_count": 0
		},
		"pricing": {
			"detected": true,
			"has_tiers": true
		},
		"case_studies": {
			"detected": false,
			"count": 0
		},
		"forms": {
			"count": 0,
			"types": []
		},
		"social_links": {},
		"mobile": {
			"viewport_meta": true,
			"responsive": true
		},
		"chat": {
			"detected": false,
			"provider": null
		},
		"performance": {
			"ttfb_ms": 29825
		},
		"pages_crawled": 1,
		"smart_stop_reason": "in_progress",
		"screenshotUrl": "https://api.apify.com/v2/key-value-stores/default/records/screenshot_NbpniPg5KTIgGlY.png",
		"scrapeDate": "2026-06-25T19:00:47.313Z",
		"humanAssessment": null
	},
	"errors": []
}