{
	"platform": "pinterest",
	"url": "https://www.pinterest.com/bestbuy/",
	"crawlerUsed": "playwright",
	"scrapedAt": "2026-06-25T19:01:10.528Z",
	"data": {
		"username": "bestbuy",
		"fullName": "Best Buy",
		"followerCount": 219544,
		"followers": 219544,
		"followingCount": 86,
		"pinsCount": 368217,
		"boardsCount": 19,
		"monthlyViews": null,
		"websiteUrl": "http://www.bestbuy.com",
		"bio_analysis": {
			"bioText": "Take what you love to the  next level with the right tech.",
			"conversionSignals": [],
			"authoritySignals": [],
			"revenueModelSignals": [],
			"hasConversionCta": false,
			"hasAuthorityProof": false,
			"hasClearRevenueModel": false
		},
		"revenueIndicators": {
			"ctas": [
				"Website"
			],
			"links": [
				"http://www.bestbuy.com"
			],
			"conversionMarkers": [
				"Followers: 219544"
			]
		},
		"screenshotUrl": "https://api.apify.com/v2/key-value-stores/default/records/screenshot_wt9ZJ8QglAAehP8.png",
		"crawlMetadata": {
			"title": "Best Buy (bestbuy) | Official Pinterest account",
			"h1": "Best Buy",
			"metaDescription": "Take what you love to the  next level with the right tech.",
			"httpStatus": 200,
			"snippet": "Take what you love to the  next level with the right tech."
		},
		"linkAudit": {
			"originalUrl": "http://www.bestbuy.com",
			"finalUrl": "https://www.bestbuy.com/",
			"redirectCount": 1,
			"isOptimized": false,
			"trackingParams": [],
			"isLinkTree": false,
			"hasSsl": true
		},
		"isLinkOptimized": false,
		"isLinkTreeUsed": false,
		"scrapeDate": "2026-06-25T19:01:10.528Z",
		"humanAssessment": null
	},
	"errors": []
}