{
	"platform": "tiktok",
	"url": "https://www.tiktok.com/@bestbuy",
	"crawlerUsed": "playwright",
	"scrapedAt": "2026-06-25T19:02:01.858Z",
	"data": {
		"username": "bestbuy",
		"displayName": "Best Buy",
		"biography": "TechTok.",
		"verified": true,
		"followerCount": 76400,
		"followers": 76400,
		"followingCount": 100,
		"likesCount": 621000,
		"videosCount": 723,
		"latestVideoDate": null,
		"externalUrl": "visitstore.bio/bestbuyshop",
		"isBusiness": true,
		"hasShop": false,
		"bio_analysis": {
			"bioText": "TechTok.",
			"conversionSignals": [],
			"authoritySignals": [],
			"revenueModelSignals": [],
			"hasConversionCta": false,
			"hasAuthorityProof": false,
			"hasClearRevenueModel": false
		},
		"screenshotUrl": "https://api.apify.com/v2/key-value-stores/default/records/screenshot_uyARhRsxI58l8JV.png",
		"scrapeDate": "2026-06-25T19:02:01.858Z",
		"humanAssessment": null
	},
	"errors": []
}